{
  "$schema": "https://json-schema.org/draft/2020-12/schema",
  "$id": "https://vexy.art/schema/vexy-stax-scene.schema.json",
  "title": "Vexy Stax Scene",
  "description": "Shared scene format v1 for vexy-stax-py and vexy-stax-js. See SPEC.md.",
  "type": "object",
  "additionalProperties": false,
  "required": ["version", "slides"],
  "properties": {
    "$schema": { "type": "string" },
    "version": { "const": 1 },
    "view": {
      "description": "Initial view to render.",
      "enum": ["expanded", "compact"],
      "default": "expanded"
    },
    "size": {
      "type": "object",
      "additionalProperties": false,
      "properties": {
        "width": { "type": "integer", "minimum": 1, "default": 1920 },
        "height": { "type": "integer", "minimum": 1, "default": 1080 }
      }
    },
    "camera": {
      "type": "object",
      "additionalProperties": false,
      "properties": {
        "gap": { "type": "number", "minimum": 0, "default": 1920, "description": "Points between adjacent plates in expanded view." },
        "distance": {
          "description": "Camera distance: absolute points as a number/string, or viewport-fit percentage like \"90%\".",
          "anyOf": [{ "type": "number" }, { "type": "string", "pattern": "^[0-9]+(\\.[0-9]+)?%?$" }],
          "default": "100%"
        },
        "angle": { "type": "number", "default": 60, "description": "Azimuth degrees for expanded view." },
        "elevation": { "type": "number", "default": 0, "description": "Degrees above horizon for expanded view." },
        "fov": { "type": "number", "exclusiveMinimum": 0, "exclusiveMaximum": 180, "default": 39.6 }
      }
    },
    "transition": {
      "type": "object",
      "additionalProperties": false,
      "required": ["kind"],
      "properties": {
        "kind": { "enum": ["expand", "collapse", "expand_collapse", "collapse_expand"] },
        "duration": { "type": "number", "exclusiveMinimum": 0, "default": 3.0, "description": "Seconds per leg." },
        "wait": { "type": "number", "minimum": 0, "default": 1.0, "description": "Hold seconds at the far end." },
        "fps": { "type": "integer", "minimum": 1, "default": 30 },
        "easing": { "enum": ["linear", "easeInOutCubic", "easeOutCubic", "easeInCubic"], "default": "easeInOutCubic" }
      }
    },
    "floor": {
      "type": "object",
      "additionalProperties": false,
      "properties": {
        "color": { "type": "string", "default": "#ffffff" },
        "opacity": { "type": "number", "minimum": 0, "maximum": 1, "default": 0.0, "description": "Invisible floor pane by default (no grey rectangle); faint reflections only." },
        "reflectivity": { "type": "number", "minimum": 0, "maximum": 1, "default": 0.1 }
      }
    },
    "edge": {
      "type": "object",
      "additionalProperties": false,
      "description": "Visible plate border (issue 305), default-on.",
      "properties": {
        "width": { "type": "number", "minimum": 0, "default": 0.0, "description": "Border thickness as a fraction of plate height; 0 = off (issue 326: slide + caption borders off by default)." },
        "color": { "type": "string", "default": "#f2f2f2", "description": "Slide-plate border color; also the default caption plate fill + border (issue 324)." }
      }
    },
    "background": { "type": "string", "default": "#ffffff" },
    "juicy": { "type": "boolean", "default": false, "description": "Python-only per-channel color match." },
    "captions": { "type": "boolean", "default": true, "description": "Global captions toggle (issue 332). ON: each slide plate sits on top of its on-floor caption plate (stacked layout). OFF: no caption plates; slide plates sit directly on the floor." },
    "video": {
      "type": "object",
      "additionalProperties": false,
      "description": "Video render params (issue 335 §3): dimensions/fps/frame counts/held stills. transition still owns the animation (kind/easing/wait/duration); video owns the output framing. Defaults preserve prior behavior.",
      "properties": {
        "width": { "type": "integer", "minimum": 1, "description": "Video width; omitted ⇒ size.width." },
        "height": { "type": "integer", "minimum": 1, "description": "Video height; omitted ⇒ size.height." },
        "fps": { "type": "integer", "minimum": 1, "description": "Video frames per second; omitted ⇒ transition.fps (else 30). Overrides transition.fps when set." },
        "frames": { "type": "integer", "minimum": 1, "description": "Transition frames PER LEG; omitted ⇒ round(transition.duration × fps)." },
        "first_hold": { "type": "integer", "minimum": 0, "default": 10, "description": "Held copies of the FIRST frame (still intro)." },
        "last_hold": { "type": "integer", "minimum": 0, "default": 10, "description": "Held copies of the LAST frame (still outro)." }
      }
    },
    "caption_defaults": { "$ref": "#/$defs/captionStyle" },
    "caption_fade": {
      "type": "object",
      "additionalProperties": false,
      "description": "Caption fade-in timing during a transition (issue 302 §B.4 / 309).",
      "properties": {
        "window": { "type": "number", "exclusiveMinimum": 0, "maximum": 1, "default": 0.9, "description": "Fraction of the morph (from the end) over which captions fade in." },
        "stagger": { "type": "number", "minimum": 0, "exclusiveMaximum": 1, "default": 0.3, "description": "Back→front succession spread as a fraction of the fade window." },
        "stagger_frames": { "type": "integer", "minimum": 0, "description": "Issue 309: back→front per-caption step in transition frames; overrides stagger when set." }
      }
    },
    "slides": {
      "type": "array",
      "minItems": 1,
      "description": "Ordered back-to-front: index 0 is farthest from the camera.",
      "items": { "$ref": "#/$defs/slide" }
    }
  },
  "$defs": {
    "slide": {
      "type": "object",
      "additionalProperties": false,
      "required": ["src"],
      "properties": {
        "src": { "type": "string", "description": "Path relative to the scene file, or a data: URI." },
        "gap": {
          "description": "Per-slide gap override (points). null uses camera.gap.",
          "anyOf": [{ "type": "number", "minimum": 0 }, { "type": "null" }],
          "default": null
        },
        "opacity": { "$ref": "#/$defs/opacity" },
        "caption": { "$ref": "#/$defs/caption" }
      }
    },
    "opacity": {
      "description": "Constant scalar, or per-view values interpolated during transitions.",
      "default": 1.0,
      "anyOf": [
        { "type": "number", "minimum": 0, "maximum": 1 },
        {
          "type": "object",
          "additionalProperties": false,
          "properties": {
            "expanded": { "type": "number", "minimum": 0, "maximum": 1, "default": 1.0 },
            "compact": { "type": "number", "minimum": 0, "maximum": 1, "default": 1.0 }
          }
        }
      ]
    },
    "caption": {
      "type": "object",
      "additionalProperties": false,
      "required": ["text"],
      "properties": {
        "text": { "type": "string" },
        "show_in": { "enum": ["expanded", "compact", "both", "none"], "default": "expanded" },
        "style": { "$ref": "#/$defs/captionStyle" }
      }
    },
    "captionStyle": {
      "type": "object",
      "additionalProperties": false,
      "properties": {
        "size": {
          "type": "number",
          "exclusiveMinimum": 0,
          "description": "Font size for the caption text (1em) in scene-point units."
        },
        "color": {
          "type": "string",
          "description": "Color for the caption text (e.g., hex string like '#222222')."
        },
        "font": {
          "type": "string",
          "description": "Font family name (e.g., 'sans-serif', 'Arial') or a path to a TrueType/OpenType font file."
        },
        "fill_color": {
          "type": "string",
          "description": "Caption plate FILL color (issue 324); defaults to scene.edge.color when omitted."
        },
        "border_color": {
          "type": "string",
          "description": "Caption plate BORDER color (issue 324); defaults to scene.edge.color when omitted."
        }
      }
    }
  }
}
